Model;Name;Price
INTOEM1700;Intel® Laminar RM1 Cooler Specifications for Intel® Core Processors 12th, 13th and 14th Generation;2.49€
ACALP00035A;CPU COOLER SAM5/SAM4/ALPINE 23 ACALP00035A ARCTIC;6.99€
ACALP00036A;CPU COOLER SAM5/SAM4/ACALP00036 ARCTIC;8.59€
E97379-003;Intel E97379-003 Kompiuterio aušinimo sistema Procesorius Orinis aušintuvas Aliuminis, Juoda;8.69€
ACALP00040A;CPU COOLER S1700/ACALP00040A ARCTIC;9.19€
XC232;XILENCE Performance C I350PWM Cooler for Intel;9.79€
ACALP00041A;CPU COOLER S1700/ACALP00041A ARCTIC;9.79€
BXTSRM1;INTEL Laminar RM1 Cooler;11.79€
CL-P106-AL09WT-A;Thermaltake Contac 9 SE;14.59€
XC025;XILENCE Performance C CPU cooler 2HP Cooler AMD;16.59€
ACFRE00077A;CPU COOLER S_MULTI/ACFRE00077A ARCTIC;18.89€
CL-P094-AL09WT-A;Thermaltake Gravity i3 Procesorius Orinis aušintuvas 9,2 cm Juoda, Nerūdijančiojo plieno 1 vnt;21.29€
FROST X2;SAVIO FROST X2 CPU aušintuvas;21.59€
KRX0135;Krux Integrator RGB 92mm LGA1700 aušintuvas;22.29€
CL-P064-AL12SW-A;THERMALTAKE UX 100 Air Cooler ARGB;23.00€
FROST BLACK X2;Savio SAVGCOFROSTBLACKX2 Kompiuterio aušinimo sistema Radiatorius 12 cm Juoda;23.29€
SAVGCOVORTEXX2;CPU Cooler SAVIO VORTEX X2;24.99€
AEROPGSAIR-FROST2-FR;Aerocool Air Frost 2 Procesorius Aušintuvas 9 cm Juoda;25.59€
BK030;BE QUIET PURE ROCK Slim 2 CPU COOLER;26.39€
EY3A001;ENDORFY Spartan 5 Procesorius Orinis aušintuvas 12 cm Juoda;26.49€
SAVGCOVORTEXX2ARGB;CPU Cooler VORTEC X2 ARGB;26.79€
CGR-FZAE50;COUGAR FORZA50 ESSENTIAL Air Cooling;27.29€
EY3A002;ENDORFY Spartan 5 ARGB CPU Cooler;28.99€
AEROPGSAIR-FROST4-FR;Aerocool Air Frost 4 Procesorius Aušintuvas 9 cm Juoda;29.39€
EY3A003;ENDORFY Spartan 5 MAX CPU Cooler;31.19€
CL-P049-AL09BL-A;CPU COOLER S_MULTI/CL-P049-AL09BL-A THERMALTAKE;32.19€
ACFRE00121A;CPU COOLER S_MULTI/ACFRE00121A ARCTIC;32.99€
AEROPGSRAVE4-FRGB-4P;Aerocool PGS Rave 4 FRGB PWM 4P;33.49€
EY3A004;ENDORFY Spartan 5 MAX ARGB Procesorius Orinis aušintuvas 12 cm Juodas AMD AM4, AM5, Intel LGA1700, LGA1200;33.89€
ACFRE00122A;CPU COOLER S_MULTI/ACFRE00122A ARCTIC;34.69€
CL-P116-AL12SW-A;Thermaltake UX200 SE AR GB Snow;35.29€
NA-HC4.BLACK;Noctua NA-HC4 chromax.black Procesorius Aušintuvas Juoda;36.99€
CGR-FZA50;COUGAR FORZA 50 Air Cooling;37.90€
CL-P065-AL12SW-A;THERMALTAKE UX 200 Air cooler PWM;38.39€
XC044;XILENCE Performance C CPU cooler 4HP Cooler Universal;40.39€
CL-P039-AL12BL-A;THERMALTAKE Contac Silent 12 CPU Cooler Intel Sockel LGA 1155/1156/1151/1150/1366/77AMD Sockel FM2/FM2+/FM1/AM3+/AM3/AM2+/AM;40.89€
EY3A005;ENDORFY Fera 5 CPU Cooler;40.89€
CGR-FZAE85;COUGAR FORZA85 ESSENTIAL Air Cooling;42.39€
AEROPGSRAVE3-FRGB-4P;Aerocool PGS Rave 3 FRGB PWM 4P;42.69€
APNX-AP1-V-ARG-BK;APNX AP1-V ARGB Procesorius Orinis aušintuvas Juoda;42.89€
BK007;BE QUIET PURE ROCK 2 cooler black;43.39€
CL-P074-AL12BL-A;Thermaltake Toughair 310 Procesorius Aušintuvas 12 cm Juoda, Sidabras;44.49€
ACFRE00124A;CPU COOLER S_MULTI/ACFRE00124A ARCTIC;44.59€
EY3A006;ENDORFY Fera 5 Dual Fan CPU Cooler;45.59€
XC081;XILENCE Performance X M906 CPU-Cooler;46.39€
EY3A011;ENDORFY Fera 5 Black, Fluctus 120 PWM fan,  AMD, Intel;46.39€
EY3A012;„Endorfa Fera 5 Black ARGB CPU aušintuvas;47.89€
EY3A007;ENDORFY Fera 5 ARGB CPU Cooler;47.99€
BK002;BE QUIET BK002 Shadow Rock LP LGA1200,LGA1700, AM4, AM5 TDP 130W;48.29€
VK-AIRSL125W;Valkyrie VK-AIRSL125W Kompiuterio aušinimo sistema Procesorius Orinis aušintuvas Juoda;49.19€
BK034;BE QUIET Pure Rock LP CPU Cooler;49.69€
AEROPGSRIME4-ARGP-4P;Aerocool Rime 4 Procesorius Orinis aušintuvas 12 cm Juoda 1 vnt;50.19€
CL-P002-AL14BL-B;THERMALTAKE Frio Silent 14 CPU-Cooler supports all current Intel and AMD platforms up to 165W 140mm fan 3pcs 8mm;50.39€
CL-P079-CA12SW-A;CPU COOLER S_MULTI/CL-P079-CA12SW-A THERMALTAKE;50.69€
BK033;BE QUIET PURE ROCK 2 FX Black;51.59€
RC-TN120-B1;NZXT CPU cooling T120 black;52.89€
RC-TN120-W1;NZXT CPU cooling T120 white;52.89€
CL-P075-AL12BL-A;Thermaltake Toughair 510 Procesorius Aušintuvas 12 cm Juoda;53.39€
R-LE300-BKLNMG-G-1;Deepcool | LE300 Marrs | CPU Liquid Cooler | Black | Intel, AMD;53.59€
RR-D6WW-20PA-R1;Cooler Master | HYPER 622 HALO White | Cooler;54.19€
EY3A008;ENDORFY Fortis 5 CPU Cooler;55.19€
CGR-FZA85;COUGAR FORZA 85 Air Cooling;57.49€
NH-L9A-AM4;Noctua NH-L9a-AM4 - Processor - Cooler - 9.2 cm - Socket AM4 - AMD A - 600 RPM;59.29€
EY3A013;„Endorfa Fortis 5 Black CPU aušintuvas;59.29€
R-ASN4S-WHGPMN-G;Deepcool | CPU Cooler | ASSASSIN 4S WH | Intel, AMD;59.39€
RC-TR120-B1;NZXT CPU cooling T120 RGB black;60.39€
RC-TR120-W1;NZXT T120 RGB Procesorius Orinis aušintuvas 12 cm Balta 1 vnt;60.39€
NH-L9I-17XX;Noctua Kühler NH-L9i 17xx Procesorius Aušintuvas 9,2 cm Rusvai gelsvas, Ruda 1 vnt;60.49€
NH-L9I;Noctua NH-L9i Procesorius Aušintuvas 9,2 cm Rusvai gelsvas, Ruda, Sidabras;60.49€
EY3A009;ENDORFY Fortis 5 Dual Fan CPU Cooler;61.29€
SAVGCOVELOX240MM;WATER COOLING 240 mm SAVIO;62.19€
R-ASN4-WHNNMT-G;Deepcool | ASSASSIN IV WH | Intel, AMD | CPU Cooler;62.99€
BK024;BE QUIET BK024 CPU cooler Dark Rock Slim 1150 1151 1155 1156 1366 2011 AM2 AM3 AM4;63.29€
SNK-P0077P;Supermicro SNK-P0077P Kompiuterio aušinimo sistema Procesorius Radiatorius Juoda, Nerūdijančiojo plieno;63.59€
MLW-D24M-A18PZ-RW;COOLER MASTER CPU water cooling Masterliquid 240L Core ARGB White;66.19€
NH-U12S REDUX;Noctua NH-U12S redux Procesorius Aušintuvas 12 cm Pilka, Nerūdijančiojo plieno;67.19€
EY3A010;ENDORFY Fortis 5 ARGB CPU Cooler;67.19€
EY3A014;„Endorfa Fortis 5 Black ARGB CPU aušintuvas;67.39€
R-LE500-BKLNMG-G-1;Deepcool | LE500 | CPU Liquid Cooler | Black | Intel, AMD;67.79€
NH-L9X65;Noctua NH-L9x65 Procesorius Aušintuvas 9,2 cm;69.59€
MAG CORELIQUID A13 240;MSI MAG CORELIQUID A13 240;69.59€
BK003;BE QUIET BK003 Shadow Rock TF2 CPU cooler 1150 1151 1155 1156 AM4 AM2 + AM3 + FM1-2;70.29€
NH-D9L;Noctua NH-D9L kompiuterio aušinimo komponentas Procesorius Aušintuvas 9,2 cm Metalinis;70.99€
CLC-240-BLK;CHIEFTEC ICEBERG 240 DARK CPU Liquid Cooler;70.99€
NH-L9I-17XXCH.BK.;NOCTUA PROCESORIAUS AUŠINIMAS NH-L9I-17XX CHROMAX BLACK;72.59€
NH-L9I CH.BK;Noctua NH-L9i chromax.black Procesorius Aušintuvas 9,2 cm Juoda  Intel LGA1150, LGA1151, LGA1155, LGA1156, LGA1200;72.59€
CGR-FZA135;COUGAR FORZA 135 Air Cooling, Dual Tower;72.59€
CLC-240-RGB;CHIEFTEC ICEBERG 240 RGB CPU Liquid Cooler;73.69€
VK-AIOA240W;Valkyrie A240 White Procesorius Universalusis skystinis aušintuvas 24 cm Balta;73.99€
NH-L9A-AM4 CH.BK;Noctua NH-L9a-AM4 chromax.black Procesorius Aušintuvas 9,2 cm Juoda;74.19€
EY3B001;ENDORFY Navis F240 CPU Cooler;75.49€
MAG CORELIQUID A13 240 WHITE;MSI MAG CORELIQUID A13 240 WHITE;76.49€
CL-W360-PL12SW-A;Thermaltake TH120 V2 AR GB;76.69€
NH-L12S;Noctua NH-L12S kompiuterio aušinimo komponentas Procesorius Aušintuvas 12 cm Rusvai gelsvas, Nikelis;77.19€
BK035;BE QUIET Dark Rock 5 cooler;77.69€
419026;Thermalright Frozen Notte 240 ARGB V2 Black Water Cooling;78.29€
CL-P095-PL14BL-A;Thermaltake TOUGHAIR TR X40;78.99€
NH-U9DXI4;NOCTUA NH-U9DXI4 PROCESORIAUS AUŠINIMAS;79.89€
NH-U9S;Noctua NH-U9S Kompiuterio aušinimo sistema Procesorius Aušintuvas 9,2 cm Ruda, Metalinis;79.89€
306-7ZWCA11-L80;MSI MAG CORELIQUID A13 240;81.39€
EY3B004;ENDORFY Navis F240 ARGB CPU Cooler;81.99€
XC974;XILENCE LiQuRizer LQ240.W.ARGB;82.29€
EY3B002;Aušinimas vandeniu Endorfy Navis F280;82.89€
CW-9060052-WW;CORSAIR H55 RGB 120mm Radiator Liquid CPU Cooler;84.89€
MAM-D8PN-318PK-R1;Cooler Master | MasterAir MA824 Stealth Cooler;85.19€
MAG CORELIQUID M240;MSI MAG CORELIQUID M240 LIQUID COOLING;86.89€
CGR-POSEIDON GT 240;COUGAR POSEIDON GT 240 AiO Liquid Watercooling;87.69€
R-ASN4S-BKGPMN-G;Deepcool | CPU Cooler | ASSASSIN 4S | Intel, AMD;88.39€
VK-AIOVL240B;Valkyrie V240 Lite Procesorius Universalusis skystinis aušintuvas 24 cm Juoda;88.79€
VK-AIOVL240W;Valkyrie V240 Lite Procesorius Universalusis skystinis aušintuvas 24 cm Balta;88.79€
CLC-360-BLK;CHIEFTEC ICEBERG 360 DARK CPU Liquid Cooler;88.99€
MAG CORELIQUID A13 360;MSI MAG CORELIQUID A13 360;90.79€
BW016;BE QUIET PURE LOOP 2 120mm;90.99€
EY3B005;ENDORFY Navis F280 ARGB Kompiuterio korpusui Universalusis skystinis aušintuvas 14 cm Juoda 1 vnt;92.89€
GP-G-MYSTIQUE240;Deepcool | CPU Cooler | MYSTIQUE 240 | Intel, AMD;96.79€
XC998;XILENCE LiQuRizer LQ360W ARGB;97.29€
ACFRE00135A;CPU COOLER S_MULTI/ACFRE00135A ARCTIC;97.29€
EY3B003;ENDORFY Navis F360 CPU Cooler;97.49€
MAG CORELIQUID A13 360 WHITE;MSI MAG CORELIQUID A13 360 WHITE;97.59€
CL-W361-PL12SW-A;Thermaltake TH240 V2 AR GB;98.19€
ACFRE00142A;CPU COOLER S_MULTI/ACFRE00142A ARCTIC;98.99€
MAG CORELIQUID 240R V2;MSI MAG CORELIQUID 240R V2 Liquid CPU Cooler;100.19€
CW-9060088-WW;CORSAIR NAUTILUS 240 240mm Radiator Liquid CPU Cooler;100.19€
BK036;BE QUIET Dark Rock Pro 5 processor cooler;100.49€
NH-C14S;Noctua NH-C14S Kompiuterio aušinimo sistema Procesorius Aušintuvas 14 cm;100.59€
NH-U12STR4-SP3;Noctua NH-U12S TR4-SP3 Kompiuterio aušinimo sistema Procesorius Aušintuvas 12 cm Aliuminis, Rusvai gelsvas;100.59€
ACFRE00150A;CPU COOLER S_MULTI/ACFRE00150A ARCTIC;102.19€
CL-W375-PL14SW-A;Thermaltake TH280 V2 AR GB;102.99€
FD-WCU-CELSIUS-S24-BK;Fractal Design Celsius S24 Black | Fractal Design | Celsius S24 | Cooler;103.39€
BW017;BE QUIET PURE LOOP 2 240mm;103.79€
CL-P117-CA14BL-A;Thermaltake TOUGHAIR 71 0;104.29€
EY3B006;ENDORFY Navis F360 ARGB CPU Cooler;104.89€
CGR-AQUA RGB 280;Cougar I Aqua ARGB 280 AiO Liquid Cooling I Aqua ARGB 280 *1 + 140mm RGB fan x2 + remote control;105.89€
CGR-POSEIDON GT 360;COUGAR POSEIDON GT 360 AiO Liquid Watercooling;105.90€
AEROPGSMIRAGE-L240-B;Aerocool Mirage L240 kompiuterio aušinimo vandeniu priemonė;107.39€
MAG CORELIQUID M360;MSI MAG CORELIQUID M360 LIQUID COOLING;108.69€
MAG CORELIQUID E240;MSI MAG CORELIQUID E240;108.69€
ACFRE00137A;CPU COOLER S_MULTI/ACFRE00137A ARCTIC;108.79€
ACFRE00143A;CPU COOLER S_MULTI/ACFRE00143A ARCTIC;108.79€
VK-AIODR240B;Valkyrie VK-AIODR240B Kompiuterio aušinimo sistema Procesorius Universalusis skystinis aušintuvas Juoda;109.99€
MAG CORELIQUID E240 WHITE;MSI MAG CORELIQUID E240 WHITE;110.89€
ACFRE00151A;CPU COOLER S_MULTI/ACFRE00151A ARCTIC;112.19€
FD-WCU-CELSIUS-S36-BKO;FRACTAL DESINGN Celsius S36 Water Cooling Unit Blackout;112.69€
VK-AIODR240W;Valkyrie VK-AIODR240W Kompiuterio aušinimo sistema Procesorius Universalusis skystinis aušintuvas Juoda;113.59€
BW018;BE QUIET PURE LOOP 2 280mm;114.39€
R-LS720-WHAMMM-G-1;Deepcool | LS720 SE WH | White | Intel, AMD | CPU Liquid Cooler;115.19€
BK037;BE QUIET Dark Rock Elite RGB processor cooler;116.79€
BW020;BE QUIET LIGHT LOOP 240mm;117.49€
ACFRE00144A;CPU COOLER S_MULTI/ACFRE00144A ARCTIC;118.69€
LEVANTEX240-BKCWW;CPU COOLER S_MULTI/LEVANTEX240-BKCWW ADATA;118.69€
LEVANTEX240-WHCWW;CPU COOLER S_MULTI/LEVANTEX240-WHCWW ADATA;118.69€
G89.GA2T24W.00;CPU COOLER S_MULTI/G89.GA2T24W.00 LIAN LI;120.19€
G89.GA2T24B.00;CPU COOLER S_MULTI/G89.GA2T24B.00 LIAN LI;120.19€
90RC00U1-M0UAY0;ASUS TUF GAMING LC II 240 ARGB AIO Cooler;120.49€
MAG CORELIQUID I240;Chłodzenie wodne MSI MAG CORELIQUID I240;120.69€
MAG CORELIQUID I240 WHITE;Chłodzenie wodne MSI MAG CORELIQUID I240 WHITE;120.69€
CW-9060092-WW;CORSAIR NAUTILUS 240 ARGB 240mm Radiator Liquid CPU Cooler;120.79€
NH-D15;Noctua NH-D15 kompiuterio aušinimo komponentas Procesorius Aušintuvas 14 cm;121.19€
ACFRE00152A;CPU COOLER S_MULTI/ACFRE00152A ARCTIC;121.99€
BW024;BE QUIET SILENT LOOP 3 240mm;122.29€
CW-9060089-WW;CORSAIR NAUTILUS 360 360mm Radiator Liquid CPU Cooler;122.59€
AORUS WATERFORCE II 240;GIGABYTE AORUS WATERFORCE II 240;122.69€
CL-W362-PL12SW-A;Thermaltake TH360 V2 AR GB;122.69€
90RC0101-B0EAY0;ASUS PRIME LC 360 ARGB all-in-one liquid CPU cooler;124.49€
CL-W418-PL00BL-A;Thermaltake Toughliquid 240 EX Pro ARGB;125.69€
FD-W-L1-S2811;FRACTAL DESIGN Lumen S28 v2;126.19€
R-LP240-BKMSNC-G-1;Deepcool | Liquid CPU cooler | LP240 | Intel, AMD;126.39€
NH-D15S CH.BK;Noctua NH-D15S chromax.black Procesorius Aušintuvas 14 cm Juoda 1 vnt;126.69€
ACFRE00145A;CPU COOLER S_MULTI/ACFRE00145A ARCTIC;126.99€
CW-9060094-WW;Corsair NAUTILUS 240 RS ARGB Liquid Procesorius Universalusis skystinis aušintuvas Balta 1 vnt;127.00€
CW-9060092-WW;Corsair NAUTILUS 240 RS ARGB Liquid Procesorius Universalusis skystinis aušintuvas Juoda 1 vnt;127.00€
R-LT240-BKAMNC-G-1;Deepcool | Liquid CPU cooler | LT240 ARGB | Intel, AMD;127.99€
R-LT240-WHAMNC-G-1;Deepcool | Liquid CPU cooler | LT240 WH ARGB | Intel, AMD;127.99€
BW019;BE QUIET PURE LOOP 2 360mm;129.69€
BW013;BE QUIET PURE LOOP 2 FX 240mm;130.19€
ACFRE00153A;CPU COOLER S_MULTI/ACFRE00153A ARCTIC;130.29€
MLX-D24M-A25PZ-R1;COOLER MASTER Water cooling MasterLiquid 240 Atmos RGB;130.99€
AEROPGSMIRAGE-L360-B;AEROCOOL PGS MIRAGE L360 ARGB BK vandens aušintuvas;132.19€
MLX-D24M-A25PZ-RW;COOLER MASTER COOLER MasterLiquid 240 Atmos ARGB White;133.39€
MAG CORELIQUID E360;MSI MAG CORELIQUID E360;136.49€
FD-W-L1-S3611;FRACTAL DESIGN Lumen S36 v2;136.79€
BW022;BE QUIET LIGHT LOOP 360mm;136.89€
CL-W419-PL00BL-A;Thermaltake Toughliquid 280 EX Pro ARGB;139.79€
BW010;BE QUIET SILENT LOOP 2 240mm;140.99€
BW014;BE QUIET PURE LOOP 2 FX 280mm;142.59€
BW023;BE QUIET LIGHT LOOP 360mm White;144.19€
BW025;BE QUIET SILENT LOOP 3 360mm;145.39€
RL-KN240-B1;NZXT CPU water cooling Kraken 240 LCD;147.99€
MLX-D36M-A25PZ-R1;COOLER MASTER Water cooling MasterLiquid 360 Atmos RGB;148.19€
R-LT360-BKAMNC-G-1;Deepcool | Liquid CPU cooler | LT360 ARGB | Intel, AMD;151.59€
R-LT360-WHAMNC-G-1;Deepcool | Liquid CPU cooler | LT360 WH ARGB | Intel, AMD;151.59€
GP-AORUS WATERFORCE 240;GIGABYTE AORUS WATERFORCE 240LIQUID CPU COOLER with ARGB display;151.99€
BW015;BE QUIET PURE LOOP 2 FX 360mm;152.49€
BW026;BE QUIET SILENT LOOP 3 420mm;153.99€
BW011;BE QUIET SILENT LOOP 2 280mm;154.19€
RL-KN280-B1;NZXT CPU water cooling Kraken 280 LCD;154.79€
FD-WCU-CELSIUS-S36-BK;Fractal Design | Celsius S36 | Cooler;154.89€
CL-W400-PL12BL-A;Thermaltake Toughliquid 360 EX Pro ARGB;154.89€
NH-U14S DX-4677;Noctua NH-U14S DX-4677 NH-U14S DX-4677 Procesorius Orinis aušintuvas 14 cm Ruda, Šviesiai ruda, Sidabras;155.59€
LEVANTEX360-BKCWW;CPU COOLER S_MULTI/LEVANTEX360-BKCWW ADATA;159.79€
G89.GA2T24INB.00;CPU COOLER S_MULTI/G89.GA2T24INB.00 LIAN LI;161.29€
G89.GA2T24INW.00;CPU COOLER S_MULTI/G89.GA2T24INW.00 LIAN LI;161.29€
GP-AORUS WATERFORCE 280;GIGABYTE AORUS WATERFORCE 280LIQUID CPU COOLER with ARGB display;162.19€
NH-D15G2;Noctua NH-D15 G2 Kompiuterio aušinimo sistema Procesorius Orinis aušintuvas 14 cm;162.49€
NH-D15G2HBC;Noctua NH-D15 G2 HBC Kompiuterio aušinimo sistema Procesorius Orinis aušintuvas 14 cm;162.49€
NH-D15G2LBC;Noctua NH-D15 G2 LBC Kompiuterio aušinimo sistema Procesorius Orinis aušintuvas 14 cm;162.49€
AORUS WATERFORCE II 360 ICE;GIGABYTE AORUS WATERFORCE II 360 ICE;163.59€
90RC0111-B0EAY0;ASUS PRIME LC 240 ARGB all-in-one liquid CPU cooler;164.19€
CL-W383-PL12SW-A;Thermaltake TH240 V2 Ul tra ARGB;167.39€
CW-9061016-WW;CORSAIR iCUE LINK TITAN 240 RX RGB AIO 240mm Radiator Liquid CPU Cooler;167.69€
RL-KR240-B1;NZXT CPU water cooling Kraken 240 RGB LCD;171.39€
CL-W401-PL14BL-A;Thermaltake Toughliquid 420 EX Pro ARGB;173.19€
BW012;BE QUIET SILENT LOOP 2 360mm;176.59€
CW-9061017-WW;Corsair | AIO Liquid CPU Cooler | iCUE LINK TITAN 280 RX RGB | Intel, AMD;178.89€
RL-KR280-W1;NZXT CPU water cooling Kraken 280 RGB LCD White;180.59€
CW-9061020-WW;Corsair iCUE LINK TITAN RX RGB Procesorius Universalusis skystinis aušintuvas 12 cm Balta 1 vnt;185.19€
CW-9061001-WW;CORSAIR iCUE LINK H100i RGB AIO 240mm Radiator Liquid CPU Cooler;186.49€
RL-KR280-B1;NZXT CPU water cooling Kraken 280 RGB LCD;189.39€
CL-W384-PL12SW-A;Thermaltake TH360 V2 Ul tra ARGB;190.19€
R-LX750-BKADSNC-G-1;Deepcool | CPU Cooler | MYSTIQUE 360 ARGB | Intel, AMD;191.99€
RL-KR240-W1;NZXT CPU water cooling Kraken 240 RGB LCD White;192.99€
CW-9061005-WW;CORSAIR iCUE LINK H100i RGB White AIO 240mm Radiator Liquid CPU Cooler;193.39€
CW-9061018-WW;CORSAIR iCUE LINK TITAN 360 RX RGB AIO 360mm Radiator Liquid CPU Cooler;201.49€
CL-W407-PL14SW-A;Thermaltake TH420 V2 Ul ltra ARGB;207.29€
GP-AORUS WATERFORCE X 280;GIGABYTE AORUS WATERFORCE X 280 All-in-one Liquid Cooler with Circular LCD Display RGB Fusion 2.0 Triple 140mm ARGB;209.39€
CW-9061021-WW;CPU Cooling iCUE LINK TITAN 360 RX RGB AIO 360mm White;211.19€
CW-9061021-WW;Corsair iCUE LINK TITAN RX RGB Procesorius Universalusis skystinis aušintuvas 12 cm Balta 1 vnt;212.69€
RL-KN28E-B1;NZXT CPU water cooling Kraken Elite 280 LCD;213.29€
G89.GHSLCD36RW.00;CPU COOLER S_MULTI/G89.GHSLCD36RW.00 LIAN LI;213.89€
CW-9060073-WW;Corsair CW-9060073-WW Kompiuterio aušinimo sistema Procesorius Universalusis skystinis aušintuvas 12 cm Balta 1 vnt;216.19€
RL-KN24E-B1;NZXT CPU water cooling Kraken Elite 240 LCD;219.89€
90RC0120-M0UAY0;ASUS ProArt LC 360 AIO Liquid Cooler;223.39€
RL-KR24E-B1;NZXT CPU water cooling Kraken Elite 240 RGB LCD;232.19€
RL-KRX63-RW;NZXT water cooling Kraken X63 White RGB 280mm Illuminated fans and pump;236.99€
MLY-D36M-A24PZ-R1;Cooler Master MasterLiquid 360 ION Procesorius Universalusis skystinis aušintuvas 12 cm Juoda 1 vnt;237.00€
AORUS WATERFORCE X II 240;GIGABYTE AORUS WATERFORCE X II 240;237.99€
90RC00S2-M0UAY0;ASUS ROG Strix LC III 240 ARGB WHT all-in-one CPU liquid cooler with 360 rotatable water block Premium ROG ARGB fans;239.19€
RL-KR28E-B1;NZXT CPU water cooling Kraken Elite 280 RGB LCD;243.99€
90RC00J1-M0UAY0;ASUS ROG RYUO III 240 ARGB all-in-one CPU liquid cooler with Asetek 8th gen pump solution and Anime Matrix LED Display;245.89€
RL-KR28E-W1;NZXT CPU water cooling Kraken Elite 280 RGB LCD White;251.59€
CL-W366-PL14BL-A;Thermaltake Toughliquid ultra 420;255.99€
GP-AORUS WATERFORCEX II 360I;GIGABYTE AORUS WATERFORCEX II 360I AIO Liquid CPU Cooler;256.79€
CW-9061022-WW;CORSAIR iCUE LINK TITAN 240 RX LCD AIO 240mm Radiator Liquid CPU Cooler;257.79€
CW-9061025-WW;CORSAIR iCUE LINK TITAN 240 RX LCD White AIO 240mm Radiator Liquid CPU Cooler;266.19€
CW-9061007-WW;CORSAIR iCUE LINK H100i LCD AIO 240mm Radiator Liquid CPU Cooler;275.69€
CW-9061023-WW;CORSAIR iCUE LINK TITAN 360 RX LCD AIO 360mm Radiator Liquid CPU Cooler;291.59€
RL-KR36E-B2;CPU COOLER MULTI SOCKET/KRAKEN ELITE 360 RGB V2 NZXT;321.89€
CW-9060077-WW;CORSAIR iCUE H150i ELITE LCD XT Liquid CPU Cooler White;349.79€
90RC00K1-M0UAY0;ASUS ROG Ryujin III 240 ARGB all-in-one liquid CPU cooler;358.89€
90RC00K2-M0UAY0;ASUS ROG RYUJIN III 240 ARGB all-in-one liquid CPU cooler White;364.39€
